{"$schema":"http://json-schema.org/draft-07/schema#","$id":"observation.schema.json","title":"Observation","description":"A source-linked observation recorded by an agent.","type":"object","required":["observation_id","agent","run_date","claim","claim_type","confidence","sources","lifecycle"],"properties":{"observation_id":{"type":"string","minLength":1},"agent":{"type":"string","enum":["project-historian","capture-ecosystem-analyst","behavioral-research-analyst","market-community-analyst"]},"run_date":{"type":"string","format":"date"},"claim":{"type":"string","minLength":1},"claim_type":{"type":"string","enum":["evidence","inference","vendor-claim","opinion"]},"confidence":{"type":"string","enum":["high","medium","low"]},"sources":{"type":"array","minItems":1,"items":{"type":"object","required":["url","title","access_date","claim_type"],"properties":{"url":{"type":"string","format":"uri"},"title":{"type":"string","minLength":1},"access_date":{"type":"string","format":"date"},"claim_type":{"type":"string","enum":["evidence","inference","vendor-claim","opinion"]},"author":{"type":["string","null"]},"publication":{"type":["string","null"]}},"additionalProperties":false}},"supporting_evidence_ids":{"type":"array","uniqueItems":true,"items":{"type":"string"}},"conflicts_with":{"type":"array","uniqueItems":true,"items":{"type":"string"}},"tags":{"type":"array","uniqueItems":true,"items":{"type":"string"}},"lifecycle":{"type":"string","enum":["generated","reviewed","accepted","rejected","superseded"]},"supersedes":{"type":["string","null"]},"reviewed_by":{"type":["string","null"]},"reviewed_at":{"type":["string","null"],"format":"date-time"}},"allOf":[{"if":{"properties":{"claim_type":{"const":"inference"}},"required":["claim_type"]},"then":{"required":["supporting_evidence_ids"],"properties":{"supporting_evidence_ids":{"minItems":1}}}}],"additionalProperties":false}
