{"observation_id":"obs-2026-07-22-capture-001","agent":"capture-ecosystem-analyst","run_date":"2026-07-22","claim":"The provider published a new export format.","claim_type":"evidence","confidence":"high","sources":[{"url":"https://example.com/changelog","title":"Product changelog","access_date":"2026-07-22","claim_type":"evidence","author":null,"publication":"Example"}],"supporting_evidence_ids":[],"conflicts_with":[],"tags":["export"],"lifecycle":"generated","supersedes":null,"reviewed_by":null,"reviewed_at":null}
